SQL> connect sys as sysdba;
Connected.
SQL> create role manager;

Role created.

SQL> create role supervisor;

Role created.

SQL> create role marketing officer;
create role marketing officer
                      *
ERROR at line 1:
ORA-00922: missing or invalid option 


SQL> create role marketing_officer;

Role created.

SQL> grant create session, create sequence, create view, create table, create procedure to manager;

Grant succeeded.

SQL> grant create session, create sequence, create view, create table to supervisor;

Grant succeeded.

SQL> create user aaa identified by aaa;

User created.

SQL> create user bbb identified by bbb;

User created.

SQL> grant dba to manager;

Grant succeeded.

SQL> grant manager to aaa;

Grant succeeded.

SQL> grant supervisor to bbb;

Grant succeeded.

SQL> grant unlimited tablespace to aaa;

Grant succeeded.

SQL> grant unlimited tablespace to bbb;

Grant succeeded.

SQL> conn
Enter user-name: bbb
Connected.
SQL> create table department(id number(3) primary key, dept_name varchar2(50) unique;)
  2  create table department(id number(3) primary key, dept_name varchar2(50) unique);
create table department(id number(3) primary key, dept_name varchar2(50) unique;)
                                                                               *
ERROR at line 1:
ORA-00911: invalid character 


SQL> create table department(id number(3) primary key, dept_name varchar2(50) unique);

Table created.

SQL> create table contact(id number(10), mobile number(15) unique,  country varchar2(50) default bangladesh);
create table contact(id number(10), mobile number(15) unique,  country varchar2(50) default bangladesh)
                                                                                            *
ERROR at line 1:
ORA-00984: column not allowed here 


SQL> create table contact(id number(10), mobile number(15) unique,  country varchar2(50) default 'Bangladesh');

Table created.

SQL> create or replace table department(dept_id number(3) primary key, dept_name varchar2(50) unique);
create or replace table department(dept_id number(3) primary key, dept_name varchar2(50) unique)
                  *
ERROR at line 1:
ORA-00922: missing or invalid option 


SQL> drop table department;

Table dropped.

SQL> create table department(dept_id number(3) primary key, dept_name varchar2(50) unique);

Table created.

SQL> drop table contact;

Table dropped.

SQL> create table contact(con_id number(10) primary key, mobile number(15) unique,  country varchar2(50) default 'Bangladesh');

Table created.

SQL> create table employee(emp_id number(10) primary key, emp_name varchar2(20), salary number(7), joining_date, dept_id foreign key not null, con_id unique foreign key);
create table employee(emp_id number(10) primary key, emp_name varchar2(20), salary number(7), joining_date, dept_id foreign key not null, con_id unique foreign key)
                                                                                                                            *
ERROR at line 1:
ORA-00907: missing right parenthesis 


SQL> create table employee(emp_id number(10) primary key, emp_name varchar2(20), salary number(7), joining_date date, dept_id foreign key not null, con_id unique foreign key);
create table employee(emp_id number(10) primary key, emp_name varchar2(20), salary number(7), joining_date date, dept_id foreign key not null, con_id unique foreign key)
                                                                                                                                 *
ERROR at line 1:
ORA-00907: missing right parenthesis 


SQL> create table employee(emp_id number(10) primary key, emp_name varchar2(20), salary number(7), joining_date date, dept_id foreign key not null, con_id unique);
create table employee(emp_id number(10) primary key, emp_name varchar2(20), salary number(7), joining_date date, dept_id foreign key not null, con_id unique)
                                                                                                                                 *
ERROR at line 1:
ORA-00907: missing right parenthesis 


SQL> create table employee(emp_id number(10) primary key, emp_name varchar2(20), salary number(7), joining_date date, dept_id foreign key not null, con_id foreign key);
create table employee(emp_id number(10) primary key, emp_name varchar2(20), salary number(7), joining_date date, dept_id foreign key not null, con_id foreign key)
                                                                                                                                 *
ERROR at line 1:
ORA-00907: missing right parenthesis 


SQL> create table employee(emp_id number(10) primary key, emp_name varchar2(20), salary number(7) check(salary>25000), joining_date date check(joining_date<01-Jan-2000), dept_id foreign key);
create table employee(emp_id number(10) primary key, emp_name varchar2(20), salary number(7) check(salary>25000), joining_date date check(joining_date<01-Jan-2000), dept_id foreign key)
                                                                                                                                                                   *
ERROR at line 1:
ORA-02438: Column check constraint cannot reference other columns 


SQL> create table employee(emp_id number(10) primary key, emp_name varchar2(20), salary number(7) check(salary>25000), joining_date date check(joining_date<01-Jan-2000), dept_id);
create table employee(emp_id number(10) primary key, emp_name varchar2(20), salary number(7) check(salary>25000), joining_date date check(joining_date<01-Jan-2000), dept_id)
                                                                                                                                                                   *
ERROR at line 1:
ORA-02438: Column check constraint cannot reference other columns 


SQL> create table employee(emp_id number(10) primary key, emp_name varchar2(20), salary number(7) check(salary>25000), joining_date date check(date<01-Jan-2000), dept_id foreign key);
create table employee(emp_id number(10) primary key, emp_name varchar2(20), salary number(7) check(salary>25000), joining_date date check(date<01-Jan-2000), dept_id foreign key)
                                                                                                                                          *
ERROR at line 1:
ORA-00936: missing expression 


SQL> create table employee(emp_id number(10) primary key, emp_name varchar2(20), salary number(7) check(salary>25000), joining_date date check(date<01-Jan-2000), foreign key(dept_id) referrences department, foreign key(con_id) referrences contact constraints unique);
create table employee(emp_id number(10) primary key, emp_name varchar2(20), salary number(7) check(salary>25000), joining_date date check(date<01-Jan-2000), foreign key(dept_id) referrences department, foreign key(con_id) referrences contact constraints unique)
                                                                                                                                          *
ERROR at line 1:
ORA-00936: missing expression 


SQL> create table employee(emp_id number(10) primary key, emp_name varchar2(20),
  2  salary number(7) check(salary>25000),
  3  joining_date date check(date<01-Jan-2000),
  4  foreign key(dept_id) referrences department,
  5  foreign key(con_id) referrences contact unique);
joining_date date check(date<01-Jan-2000),
                        *
ERROR at line 3:
ORA-00936: missing expression 


SQL> create table employee(emp_id number(10) primary key, emp_name varchar2(20),
  2  salary number(7) check(salary>25000),
  3  joining_date date check(date<01-Jan-2000),
  4  foreign key(dept_id) referrences department,
  5  create table employee(emp_id number(10) primary key, emp_name varchar2(20),
  6  
SQL> create table employee(emp_id number(10) primary key, emp_name varchar2(20),
  2  salary number(7) check(salary>25000),
  3  joining_date date check(date<01-Jan-2000),
  4  foreign key(dept_id) referrences department,
  5  foreign key(con_id) referrences contact unique);
joining_date date check(date<01-Jan-2000),
                        *
ERROR at line 3:
ORA-00936: missing expression 


SQL> create table employee(emp_id number(10) primary key, emp_name varchar2(20),
  2  salary number(7) check(salary>25000),
  3  joining_date date check(joining_date<01-Jan-2000),
  4  foreign key(dept_id) referrences department,
  5  foreign key(con_id) referrences contact unique);
joining_date date check(joining_date<01-Jan-2000),
                                                 *
ERROR at line 3:
ORA-02438: Column check constraint cannot reference other columns 


SQL> create table employee(emp_id number(10) primary key, emp_name varchar2(20),
  2  salary number(7) check(salary>=25000),
  3  joining_date date check(joining_date<'01-Jan-2000'),
  4  foreign key(dept_id) references department,
  5  foreign key(con_id) references contact);
foreign key(dept_id) references department,
            *
ERROR at line 4:
ORA-00904: "DEPT_ID": invalid identifier 


SQL> create table employee(emp_id number(10) primary key, emp_name varchar2(20),
  2  salary number(7) check(salary>=25000),
  3  joining_date date check(joining_date<'01-Jan-2000'),
  4  foreign key (dept_id) references department,
  5  foreign key (con_id) references contact);
foreign key (dept_id) references department,
             *
ERROR at line 4:
ORA-00904: "DEPT_ID": invalid identifier 


SQL> create table employee(emp_id number(10) primary key, emp_name varchar2(20),
  2  salary number(7) check(salary>=25000),
  3  joining_date date check(joining_date<'01-Jan-2000'),
  4  foreign key (con_id) references contact);
foreign key (con_id) references contact)
             *
ERROR at line 4:
ORA-00904: "CON_ID": invalid identifier 


SQL> drop table department;

Table dropped.

SQL> drop table contact;

Table dropped.

SQL> create table department(id number(7) primary key, dept_name varchar2(50) unique);

Table created.

SQL> create table contact(id number(7) primary key, mobile number(15) unique,  country varchar2(50) default 'Bangladesh');

Table created.

SQL> create table employee(id number(7) primary key, emp_name varchar2(20),
  2  salary number(7) check(salary>=25000),
  3  joining_date date check(joining_date<='01-Jan-2000'),
  4  foreign key (id) references department,
  5  foreign key (id) references contact);

Table created.

SQL> desc employee;
 Name                                      Null?    Type
 ----------------------------------------- -------- ----------------------------
 ID                                        NOT NULL NUMBER(7)
 EMP_NAME                                           VARCHAR2(20)
 SALARY                                             NUMBER(7)
 JOINING_DATE                                       DATE

SQL> drop table employee;

Table dropped.

SQL> create table employee(id number(7) primary key, emp_name varchar2(20),
  2  salary number(7) check(salary>=25000),
  3  joining_date date check(joining_date<='01-Jan-2000'),
  4  foreign key (id) references department,
  5  foreign key (id) references contact unique);
foreign key (id) references contact unique)
                                    *
ERROR at line 5:
ORA-00907: missing right parenthesis 


SQL> create table employee(id number(7) primary key, emp_name varchar2(20),
  2  salary number(7) check(salary>=25000),
  3  joining_date date check(joining_date<='01-Jan-2000'),
  4  foreign key (id) references department,
  5  foreign key (id) references contact constraints unique);
foreign key (id) references contact constraints unique)
                                    *
ERROR at line 5:
ORA-00907: missing right parenthesis 


SQL> create table employee(id number(7) primary key, emp_name varchar2(20),
  2  salary number(7) check(salary>=25000),
  3  joining_date date check(joining_date<='01-Jan-2000'),
  4  foreign key (id) references department,
  5  foreign key (id) references contact);

Table created.

SQL> alter table employee add constraints unique(depat_id);
alter table employee add constraints unique(depat_id)
                                            *
ERROR at line 1:
ORA-01735: invalid ALTER TABLE option 


SQL> alter table employee add constraints unique(dept_id);
alter table employee add constraints unique(dept_id)
                                            *
ERROR at line 1:
ORA-01735: invalid ALTER TABLE option 


SQL> alter table employee add constraints unique(id);
alter table employee add constraints unique(id)
                                            *
ERROR at line 1:
ORA-01735: invalid ALTER TABLE option 


SQL> ALTER TABLE Persons
  2  
SQL> alter table employee add constraints unique (id);
alter table employee add constraints unique (id)
                                             *
ERROR at line 1:
ORA-01735: invalid ALTER TABLE option 


SQL> clear screen;

SQL> create table department(dept_id number(7) primary key, dept_name varchar2(50) unique);
create table department(dept_id number(7) primary key, dept_name varchar2(50) unique)
             *
ERROR at line 1:
ORA-00955: name is already used by an existing object 


SQL> drop table department;
drop table department
           *
ERROR at line 1:
ORA-02449: unique/primary keys in table referenced by foreign keys 


SQL> drop table employee;

Table dropped.

SQL> drop table contact;

Table dropped.

SQL> drop table department;

Table dropped.

SQL> clear screen;

SQL> create table department(dept_id number(7) primary key, dept_name varchar2(50) unique);

Table created.

SQL> create table contact(id number(7) primary key, mobile number(15) unique,  country varchar2(50) default 'Bangladesh');

Table created.

SQL> create table contact(con_id number(7) primary key, mobile number(15) unique,  country varchar2(50) default 'Bangladesh');
create table contact(con_id number(7) primary key, mobile number(15) unique,  country varchar2(50) default 'Bangladesh')
             *
ERROR at line 1:
ORA-00955: name is already used by an existing object 


SQL> drop table contact;

Table dropped.

SQL> create table contact(con_id number(7) primary key, mobile number(15) unique,  country varchar2(50) default 'Bangladesh');

Table created.

SQL> create table employee(id number(7) primary key, emp_name varchar2(20),
  2    2  salary number(7) check(salary>=25000),
  3    3  joining_date date check(joining_date<='01-Jan-2000'), dept_id number(7) not null, con_id number(7),
  4    4  constraint foreign key (dept_id) references department, constraint foreign key (con_id) references contact);
  2  salary number(7) check(salary>=25000),
  *
ERROR at line 2:
ORA-00904: : invalid identifier 


SQL> create table employee(id number(7) primary key, emp_name varchar2(20),
  2    2  salary number(7) check(salary>=25000),
  3    3  joining_date date check(joining_date<='01-Jan-2000'), dept_id number(7) not null, con_id number(7),
  4    4  constraint foreign key (dept_id) references department, constraint foreign key (con_id) references contact);
  2  salary number(7) check(salary>=25000),
  *
ERROR at line 2:
ORA-00904: : invalid identifier 


SQL> create table employee(id number(7) primary key, emp_name varchar2(20),salary number(7) check(salary>=25000),joining_date date check(joining_date<='01-Jan-2000'), dept_id number(7) not null, con_id number(7),constraint foreign key (dept_id) references department, constraint foreign key (con_id) references contact);
create table employee(id number(7) primary key, emp_name varchar2(20),salary number(7) check(salary>=25000),joining_date date check(joining_date<='01-Jan-2000'), dept_id number(7) not null, con_id number(7),constraint foreign key (dept_id) references department, constraint foreign key (con_id) references contact)
                                                                                                                                                                                                                                      *
ERROR at line 1:
ORA-00902: invalid datatype 


SQL> create table employee(id number(7) primary key, emp_name varchar2(20),salary number(7) check(salary>=25000),joining_date date check(joining_date<='01-Jan-2000'), dept_id number(7) not null, con_id number(7),constraint foreign key (dept_id) references department, constraint foreign key (con_id) references contact);
create table employee(id number(7) primary key, emp_name varchar2(20),salary number(7) check(salary>=25000),joining_date date check(joining_date<='01-Jan-2000'), dept_id number(7) not null, con_id number(7),constraint foreign key (dept_id) references department, constraint foreign key (con_id) references contact)
                                                                                                                                                                                                                                      *
ERROR at line 1:
ORA-00902: invalid datatype 


SQL> create table employee(id number(7) primary key, emp_name varchar2(20),
  2  salary number(7) check(salary>=25000),
  3  joining_date date check(joining_date<='01-Jan-2000'),
  4  dept_id number(7) not null, con_id number(7),
  5  constraint foreign key (dept_id) references department, constraint foreign key (con_id) references contact);
constraint foreign key (dept_id) references department, constraint foreign key (con_id) references contact)
                       *
ERROR at line 5:
ORA-00902: invalid datatype 


SQL> create table employee(id number(7) primary key, emp_name varchar2(20),salary number(7) check(salary>=25000),joining_date date check(joining_date<='01-Jan-2000'), dept_id number(7) not null, con_id number(7),
  2  constraint emp_dep foreign key (dept_id) references department, constraint emp_con foreign key (con_id) references contact);

Table created.

SQL> alter table employee add constraints emp_dept_id unique (con_id);

Table altered.

SQL> insert into department(dept_id,dept_name) values(10,'Administration');

1 row created.

SQL> insert into department(dept_id,dept_name) values(20,'HR and Finance');

1 row created.

SQL> insert into department(dept_id,dept_name) values(30,'Marketing');

1 row created.

SQL> insert into department(dept_id,dept_name) values(40,'RnD');

1 row created.

SQL> delete * from department;
delete * from department
       *
ERROR at line 1:
ORA-00903: invalid table name 


SQL> delete * from department;
delete * from department
       *
ERROR at line 1:
ORA-00903: invalid table name 


SQL> delete * from department where dept_id=10;
delete * from department where dept_id=10
       *
ERROR at line 1:
ORA-00903: invalid table name 


SQL> delete from department where dept_id=10;

1 row deleted.

SQL> delete from department where dept_id=20;

1 row deleted.

SQL> delete from department where dept_id=30;

1 row deleted.

SQL> delete from department where dept_id=40;

1 row deleted.

SQL> clear screen;

SQL> create sequence dept_seq increment by 10 start with 10 nocache nocycle;

Sequence created.

SQL> create sequence con_seq increment by 5 start with 5 nocache nocycle;

Sequence created.

SQL> create sequence emp_seq increment by 1 nocache nocycle;

Sequence created.

SQL> insert into department(dept_id,dept_name) values(dept_seq.nextval,'HR and Finance')
  2  ;

1 row created.

SQL> insert into department(dept_id,dept_name) values(dept_seq.nextval,'Marketing');

1 row created.

SQL> insert into department(dept_id,dept_name) values(dept_seq.nextval,'RnD');

1 row created.

SQL> insert into department(dept_id,dept_name) values(dept_seq.nextval,'Administration');

1 row created.

SQL> select * from department;

   DEPT_ID DEPT_NAME                                                            
---------- --------------------------------------------------                   
        10 HR and Finance                                                       
        20 Marketing                                                            
        30 RnD                                                                  
        40 Administration                                                       

SQL> insert into contact(id,mobile,country) values(con_seq.nextval,01711123456);
insert into contact(id,mobile,country) values(con_seq.nextval,01711123456)
                                       *
ERROR at line 1:
ORA-00947: not enough values 


SQL> insert into contact(id,mobile,country) values(con_seq.nextval,01711123456,default);
insert into contact(id,mobile,country) values(con_seq.nextval,01711123456,default)
                    *
ERROR at line 1:
ORA-00904: "ID": invalid identifier 


SQL> insert into contact(con_id,mobile,country) values(con_seq.nextval,01712345678);
insert into contact(con_id,mobile,country) values(con_seq.nextval,01712345678)
                                           *
ERROR at line 1:
ORA-00947: not enough values 


SQL> 
SQL> insert into contact(con_id,mobile,country) values(con_seq.nextval,01712345678,'Japan');

1 row created.

SQL> insert into contact(con_id,mobile,country) values(con_seq.nextval,01712345679,'France');

1 row created.

SQL> insert into contact(con_id,mobile,country) values(con_seq.nextval,01712345680,'Italy');

1 row created.

SQL> create sequence emp_seq increment by 1 nocache nocycle;
create sequence emp_seq increment by 1 nocache nocycle
                *
ERROR at line 1:
ORA-00955: name is already used by an existing object 


SQL> create or replace sequence emp_seq increment by 1 start with 1 nocache nocycle;
create or replace sequence emp_seq increment by 1 start with 1 nocache nocycle
                  *
ERROR at line 1:
ORA-00922: missing or invalid option 


SQL> drop sequence emp_seq;

Sequence dropped.

SQL> create sequence emp_seq increment by 1 start with 1 nocache nocycle;

Sequence created.

SQL> insert into contact(con_id,mobile) values(con_seq.nextval,01712345681);

1 row created.

SQL> insert into employee(id,emp_name,salary,joining_date,dept_id,con_id)) values(emp_seq.nextval,'AAA',25000,'01-Feb-1998',10,5);
insert into employee(id,emp_name,salary,joining_date,dept_id,con_id)) values(emp_seq.nextval,'AAA',25000,'01-Feb-1998',10,5)
                                                                    *
ERROR at line 1:
ORA-00926: missing VALUES keyword 


SQL> insert into employee(id,emp_name,salary,joining_date,dept_id,con_id)) values(emp_seq.nextval,'DDD',25000,'01-Feb-1998',10,5);
insert into employee(id,emp_name,salary,joining_date,dept_id,con_id)) values(emp_seq.nextval,'DDD',25000,'01-Feb-1998',10,5)
                                                                    *
ERROR at line 1:
ORA-00926: missing VALUES keyword 


SQL> insert into employee(id,emp_name,salary,joining_date,dept_id,con_id) values(emp_seq.nextval,'DDD',25000,'01-Feb-1998',10,5);

1 row created.

SQL> insert into employee(id,emp_name,salary,joining_date,dept_id,con_id) values(emp_seq.nextval,'AAA',25000,'01-Feb-1998',10,5);
insert into employee(id,emp_name,salary,joining_date,dept_id,con_id) values(emp_seq.nextval,'AAA',25000,'01-Feb-1998',10,5)
*
ERROR at line 1:
ORA-00001: unique constraint (BBB.EMP_DEPT_ID) violated 


SQL> insert into employee(id,emp_name,salary,joining_date,dept_id,con_id) values(emp_seq.nextval,'AAA',25000,'01-Feb-1998',10,10);

1 row created.

SQL> insert into employee(id,emp_name,salary,joining_date,dept_id,con_id) values(emp_seq.nextval,'AAA',25000,'01-Feb-1998',10,15);

1 row created.

SQL> insert into employee(id,emp_name,salary,joining_date,dept_id,con_id) values(emp_seq.nextval,'AAA',25000,'01-Feb-1998',10,20);

1 row created.

SQL> create view emp_view as select e.emp_name "Emp Name", e.salary "Monthly Sal", d.dept_name "Dept Name", c.mobile, c.country from employee e, department d, contact c where e.id=d.dept_id and e.con_id=c.con_id;

View created.

SQL> create synonym esyn for emp_view;
create synonym esyn for emp_view
*
ERROR at line 1:
ORA-01031: insufficient privileges 


SQL> connect sys as sysdba;
Connected.
SQL> grant create synonym to supervisor;

Grant succeeded.

SQL> conn
Enter user-name: bbb
Connected.
SQL> create synonym esyn for emp_view;

Synonym created.

SQL> select * from employee;

        ID EMP_NAME                 SALARY JOINING_D    DEPT_ID     CON_ID      
---------- -------------------- ---------- --------- ---------- ----------      
         1 DDD                       25000 01-FEB-98         10          5      
         3 AAA                       25000 01-FEB-98         10         10      
         4 AAA                       25000 01-FEB-98         10         15      
         5 AAA                       25000 01-FEB-98         10         20      

SQL> update employee set salary=30000 where emp_name='AAA';

3 rows updated.

SQL> select * from employee;

        ID EMP_NAME                 SALARY JOINING_D    DEPT_ID     CON_ID      
---------- -------------------- ---------- --------- ---------- ----------      
         1 DDD                       25000 01-FEB-98         10          5      
         3 AAA                       30000 01-FEB-98         10         10      
         4 AAA                       30000 01-FEB-98         10         15      
         5 AAA                       30000 01-FEB-98         10         20      

SQL> update employee set salary=35000 and emp_name='BBB' where con_id=15;
update employee set salary=35000 and emp_name='BBB' where con_id=15
                                 *
ERROR at line 1:
ORA-00933: SQL command not properly ended 


SQL> update employee set salary=35000,emp_name='BBB' where con_id=15;

1 row updated.

SQL> select * from employee;

        ID EMP_NAME                 SALARY JOINING_D    DEPT_ID     CON_ID      
---------- -------------------- ---------- --------- ---------- ----------      
         1 DDD                       25000 01-FEB-98         10          5      
         3 AAA                       30000 01-FEB-98         10         10      
         4 BBB                       35000 01-FEB-98         10         15      
         5 AAA                       30000 01-FEB-98         10         20      

SQL> update employee set salary=40000, emp_name=CCC' where con_id=20;
ERROR:
ORA-01756: quoted string not properly terminated 


SQL> update employee set salary=40000, emp_name='CCC' where con_id=20;

1 row updated.

SQL> select * from employee;

        ID EMP_NAME                 SALARY JOINING_D    DEPT_ID     CON_ID      
---------- -------------------- ---------- --------- ---------- ----------      
         1 DDD                       25000 01-FEB-98         10          5      
         3 AAA                       30000 01-FEB-98         10         10      
         4 BBB                       35000 01-FEB-98         10         15      
         5 CCC                       40000 01-FEB-98         10         20      

SQL> select * from department;

   DEPT_ID DEPT_NAME                                                            
---------- --------------------------------------------------                   
        10 HR and Finance                                                       
        20 Marketing                                                            
        30 RnD                                                                  
        40 Administration                                                       

SQL> select * from contact;

    CON_ID     MOBILE COUNTRY                                                   
---------- ---------- --------------------------------------------------        
         5 1712345678 Japan                                                     
        10 1712345679 France                                                    
        15 1712345680 Italy                                                     
        20 1712345681 Bangladesh                                                

SQL> spool off;
